{
  "rayactAppKey": "__APP_KEY__",
  "devServer": {
    "host": "0.0.0.0",
    "port": 8081,
    "cdpPort": 9229
  },
  "entry": "src/App.tsx",
  "platform": "desktop",
  "transform": {
    "minify": { "dev": false, "debug": false, "release": true },
    "bytecode": { "dev": false, "debug": false, "release": false }
  }
}
