{
  "$schema": "./node_modules/@rayact/dev-server/schema/rayact.config.schema.json",
  "rayactAppKey": "rayact-demo",
  "devServer": {
    "host": "0.0.0.0",
    "port": 8081,
    "cdpPort": 9229
  },
  "entry": "test-projects/release-consumer-smoke/src/App.tsx",
  "android": {
    "packageName": "com.rayact.app"
  }
}
